{
  "imageKind": "screenshot",
  "expectedText": "SETTINGS PANEL 5 PROFILE AUTO SAVE ENABLED SYNC STATUS OK 15",
  "requiredTags": ["screenshot", "text"],
  "allowedTags": ["document", "web page", "code screenshot", "chat screenshot", "latin text", "message"],
  "forbiddenTags": ["receipt", "car"],
  "notes": "Synthetic screenshot baseline sample"
}
